{
  "schemaVersion": "1.0",
  "taskId": "t456ef70",
  "category": "exact_identifier",
  "brief": {
    "goal": "In collection c015, return the invoice identifier for the advisory engagement.",
    "instructions": [
      "Return only the declared structured claims or gaps.",
      "Cite exact evidence spans and abstain when required evidence is absent."
    ]
  },
  "claims": [
    {
      "claimKey": "invoiceId",
      "valueType": "identifier",
      "substantive": true,
      "required": true
    }
  ],
  "allowedTools": ["search", "get", "multi_get"],
  "budgets": {
    "maxAgentCalls": 3,
    "maxModelVisibleBytes": 12000
  },
  "corpus": {
    "collections": ["c015", "c115"]
  }
}
