{
  "schemaVersion": "1.0",
  "taskId": "t718293a",
  "category": "meeting_decision",
  "brief": {
    "goal": "Return the launch date approved in the release meeting.",
    "instructions": [
      "Return only the declared structured claims or gaps.",
      "Cite exact evidence spans and abstain when required evidence is absent."
    ]
  },
  "claims": [
    {
      "claimKey": "launchDate",
      "valueType": "date",
      "substantive": true,
      "required": true
    }
  ],
  "allowedTools": ["search", "get", "multi_get"],
  "budgets": {
    "maxAgentCalls": 3,
    "maxModelVisibleBytes": 12000
  },
  "corpus": {
    "collections": ["c008"]
  }
}
