{
  "schemaVersion": "1.0",
  "taskId": "t012ab3c",
  "category": "multilingual",
  "brief": {
    "goal": "¿Está activada la exportación automática según la guía en español?",
    "instructions": [
      "Return only the declared structured claims or gaps.",
      "Cite exact evidence spans and abstain when required evidence is absent."
    ]
  },
  "claims": [
    {
      "claimKey": "automaticExport",
      "valueType": "boolean",
      "substantive": true,
      "required": true
    }
  ],
  "allowedTools": ["search", "get", "multi_get"],
  "budgets": {
    "maxAgentCalls": 3,
    "maxModelVisibleBytes": 12000
  },
  "corpus": {
    "collections": ["c011"]
  }
}
